material,source,idemat_row_number,process_id_name,category,unit,total_ecocost_euro,carbon_footprint_kgCO2e,notes,source_kgCO2,water_footprint_liters,source_url_water
acrylic,Idemat,1010,A.140.01.101.240814 Acrylic fibres,Materials, textiles, materials,kg,2.136764,4.16,,,"https://www.fulgar.com/en/feature/282/water-consumption-in-the-textile-industry-challenges-and-solutions"
cashmere,Research,RESEARCH,Research-based value,Research,kg,,24.56,"Average of cashmere fibre LCA studies (range 16-33 kg CO2e/kg). Sources: Wang et al. 2022, LCA of Cashmere Fiber; secondary validations from Impactful Ninja and others.","https://www.sciencedirect.com/science/article/pii/S0959652622053768",34160.0,"https://www.sciencedirect.com/science/article/pii/S2210670722001688"
cotton_conventional,Idemat,1015,"A.140.01.106.230701 Cotton fibre trade mix (without spinning, average at farm gate, worldwide)",Materials, textiles, materials,kg,0.998151,2.29,,,"https://digitalcommons.unl.edu/cgi/viewcontent.cgi?article=1060&context=wffdocs"
cotton_organic,Idemat,1011,"A.140.01.102.230701 BioCotton fibre from China (without spinning, average at farm gate)",Materials, textiles, materials,kg,0.909286,2.15,,,"https://digitalcommons.unl.edu/cgi/viewcontent.cgi?article=1060&context=wffdocs"
cotton_recycled,Research,RESEARCH,Research-based value,Research,kg,,0.98,"Recycled cotton fibre from cutting waste (mechanical recycling). Conservatively set to ~60% lower than virgin cotton, aligned with peer-reviewed study.","https://www.mdpi.com/2071-1050/16/14/5896",155.0,"https://www.mdpi.com/2071-1050/16/14/5896"
down_feather,Research,RESEARCH,Research-based value,Research,kg,,12.5,"Estimate for virgin down based on goose/duck farming LCAs and down-specific processing overhead.","https://link.springer.com/article/10.1007/s11367-022-02068-6",2000.0,"https://link.springer.com/article/10.1007/s11367-022-02068-6"
down_synthetic,Research,RESEARCH,Research-based value,Research,kg,,4.8,"Estimate for synthetic down (polyester-based) using polyester staple fibre LCA adjusted for loft and processing.","https://link.springer.com/article/10.1007/s11367-022-02068-6",1200.0,"https://link.springer.com/article/10.1007/s11367-022-02068-6"
elastane,Idemat,1012,A.140.01.103.240814 Elastane fibres,Materials, textiles, materials,kg,3.377049,8.47,,"https://www.fulgar.com/en/feature/282/water-consumption-in-the-textile-industry-challenges-and-solutions",400.0,"https://www.fulgar.com/en/feature/282/water-consumption-in-the-textile-industry-challenges-and-solutions"
eva,Research,RESEARCH,Research-based value,Research,kg,,2.3,"EVA (Ethylene-vinyl acetate) foam base polymer. Value aligned with PlasticsEurope and independent LCA studies.",,100.0,
hemp,Research,RESEARCH,Research-based value,Research,kg,,1.7,"Hemp fibre at farm gate, average value from LCA studies. Significantly lower than cotton due to lower input requirements.","https://www.mdpi.com/2079-6439/9/9/49",200.0,"https://www.mdpi.com/2079-6439/9/9/49"
jute,Idemat,1013,"A.140.01.104.230701 Jute fibre (without wet finishing)",Materials, textiles, materials,kg,0.825395,1.91,,"https://waterfootprint.org/media/downloads/WFA_Paper_13_WaterFootprintCrops_1.pdf",200.0,"https://waterfootprint.org/media/downloads/WFA_Paper_13_WaterFootprintCrops_1.pdf"
leather_bovine,Research,RESEARCH,Research-based value,Research,kg,,31.5,"Bovine leather LCA at tannery gate. Based on combination of FAO, Higg MSI, and independent LCAs; mid-range of 25–40 kg CO2e/kg.","https://circumfauna.org/leather-carbon-footprint",17080.0,"https://circumfauna.org/leather-water-footprint"
leather_ovine,Research,RESEARCH,Research-based value,Research,kg,,25.0,"Ovine leather (sheep) approximated slightly lower than bovine leather based on FAO livestock LCAs.",,16000.0,
leather_synthetic,Research,RESEARCH,Research-based value (PU synthetic leather),Research,kg,,11.2,"PU synthetic leather (coated textile) LCA average","https://www.carbonfact.com/blog/vegan-leather",1220.0,"https://circumfauna.org/leather-water-footprint"
linen_flax,Idemat,1014,"A.140.01.105.230701 Linen fibre (without spinning, average at farm gate)",Materials, textiles, materials,kg,0.776254,1.80,,"https://waterfootprint.org/media/downloads/WFA_Paper_13_WaterFootprintCrops_1.pdf",200.0,"https://waterfootprint.org/media/downloads/WFA_Paper_13_WaterFootprintCrops_1.pdf"
lyocell_tencel,Research,RESEARCH,Research-based value,Research,kg,,2.9,"Lyocell/TENCEL fibre LCA from recent industrial-scale studies, converted to kg basis.","https://www.lenzing.com/newsroom/press-releases/2019-lyocell-lca",2500.0,"https://www.lenzing.com/newsroom/press-releases/2019-lyocell-lca"
metal_brass,Idemat,1613,"A.160.01.112.190501 Brass, at plant",Materials, metals,kg,2.056054,2.37,,"https://www.sciencedirect.com/science/article/pii/S0959652622004798",52.0,"https://www.sciencedirect.com/science/article/pii/S0959652622004798"
metal_gold,Research,RESEARCH,Research-based value,Research,kg,,114000.0,"Refined gold, cradle-to-gate. Very high due to ore grade and processing. Based on multiple LCAs summarised in academic reviews.","https://link.springer.com/article/10.1007/s11367-012-0437-8",600000.0,"https://link.springer.com/article/10.1007/s11367-012-0437-8"
metal_silver,Research,RESEARCH,Research-based value,Research,kg,,1900.0,"Refined silver, cradle-to-gate, mid-range value from LCA studies.","https://link.springer.com/article/10.1007/s11367-012-0437-8",50000.0,"https://link.springer.com/article/10.1007/s11367-012-0437-8"
metal_steel,Idemat,1602,"A.160.01.101.190501 Steel, low-alloyed, at plant",Materials, metals,kg,0.198207,1.92,,"https://waterfootprint.org/media/downloads/Report_49_Waterfootprint_metals.pdf",30.0,"https://waterfootprint.org/media/downloads/Report_49_Waterfootprint_metals.pdf"
modal,Idemat,1022,"A.140.01.113.230701 Modal fibre (without spinning)",Materials, textiles, materials,kg,1.169786,3.07,,"https://waterfootprint.org/media/downloads/WFA_Paper_13_WaterFootprintCrops_1.pdf",3500.0,"https://waterfootprint.org/media/downloads/WFA_Paper_13_WaterFootprintCrops_1.pdf"
natural_rubber,Idemat,1502,"A.150.01.102.230701 Rubber, natural (latex, without compounding)",Materials, elastomers,kg,1.336861,2.65,,"https://waterfootprint.org/media/downloads/WFA_Paper_13_WaterFootprintCrops_1.pdf",1800.0,"https://waterfootprint.org/media/downloads/WFA_Paper_13_WaterFootprintCrops_1.pdf"
polyamide_6,Idemat,1017,"A.140.01.108.240814 Polyamide 6 fibres",Materials, textiles, materials,kg,2.536394,6.54,,"https://www.fulgar.com/en/feature/282/water-consumption-in-the-textile-industry-challenges-and-solutions",100.0,"https://www.fulgar.com/en/feature/282/water-consumption-in-the-textile-industry-challenges-and-solutions"
polyamide_66,Idemat,1018,"A.140.01.109.240814 Polyamide 66 fibres",Materials, textiles, materials,kg,2.728642,6.77,,"https://www.fulgar.com/en/feature/282/water-consumption-in-the-textile-industry-challenges-and-solutions",100.0,"https://www.fulgar.com/en/feature/282/water-consumption-in-the-textile-industry-challenges-and-solutions"
polyamide_recycled,Research,RESEARCH,Research-based value,Research,kg,,2.4,"Recycled polyamide (nylon) fibres, average LCA value from industrial data and peer-reviewed studies.","https://www.sciencedirect.com/science/article/pii/S0959652622007088",80.0,"https://www.sciencedirect.com/science/article/pii/S0959652622007088"
polyester_recycled,Research,RESEARCH,Research-based value,Research,kg,,1.5,"Recycled polyester (rPET) fibres from bottle-to-fibre and textile-to-textile processes.","https://www.sciencedirect.com/science/article/pii/S0959652622004798",100.0,"https://www.sciencedirect.com/science/article/pii/S0959652622004798"
polyester_virgin,Idemat,1016,"A.140.01.107.240814 Polyester fibres",Materials, textiles, materials,kg,2.01865,4.46,,"https://www.fulgar.com/en/feature/282/water-consumption-in-the-textile-industry-challenges-and-solutions",100.0,"https://www.fulgar.com/en/feature/282/water-consumption-in-the-textile-industry-challenges-and-solutions"
rubber_synthetic,Research,RESEARCH,Research-based value (SBR synthetic rubber),Research,kg,,3.0,"Synthetic rubber SBR (styrene-butadiene rubber) base polymer.",,100.0,
silk,Idemat,1023,"A.140.01.115.230701 Silk fibre (without spinning)",Materials, textiles, materials,kg,2.484937,5.13,,"https://waterfootprint.org/media/downloads/WFA_Paper_13_WaterFootprintCrops_1.pdf",39000.0,"https://waterfootprint.org/media/downloads/WFA_Paper_13_WaterFootprintCrops_1.pdf"
tpu,Research,RESEARCH,Research-based value (thermoplastic polyurethane),Research,kg,,4.7,"TPU resin using PlasticsEurope TPU eco-profile","https://www.plasticseurope.org/application/files/2715/3748/0601/TPU_EPD-Final.pdf",200.0,"https://www.fulgar.com/en/feature/282/water-consumption-in-the-textile-industry-challenges-and-solutions"
viscose,Idemat,1027,"A.140.01.118.230701 Viscose production",Materials, textiles, materials,kg,1.506555,3.56,,"https://waterfootprint.org/media/downloads/WFA_Paper_13_WaterFootprintCrops_1.pdf",3000.0,"https://waterfootprint.org/media/downloads/WFA_Paper_13_WaterFootprintCrops_1.pdf"
wool_generic,Idemat,1028,"A.140.01.119.230701 Wool from Australia - transport to Europe by ship",Materials, textiles, materials,kg,2.951924,6.88,,"https://waterfootprint.org/media/downloads/WFA_Paper_13_WaterFootprintCrops_1.pdf",17080.0,"https://waterfootprint.org/media/downloads/WFA_Paper_13_WaterFootprintCrops_1.pdf"
wool_merino,Idemat,1028,"A.140.01.119.230701 Wool from Australia - transport to Europe by ship",Materials, textiles, materials,kg,2.951924,6.88,"Merino proxied with wool from Australia",,,
coated_fabric_pu,Research,RESEARCH,Research-based value (PU coated fabric),Research,kg,,11.2,"PU coated fabric (synthetic leather-like, coated textile) LCA average; aligned with leather_synthetic","https://www.carbonfact.com/blog/vegan-leather",1220.0,"https://circumfauna.org/leather-water-footprint"
